{
  "id": "parallax-layer",
  "name": "Parallax layer",
  "category": "scroll-motion",
  "objective": "create depth by moving background and foreground layers at different scroll speeds",
  "contexts": [
    "marketing-hero",
    "story-section"
  ],
  "technologies": [
    "CSS",
    "transform",
    "IntersectionObserver",
    "requestAnimationFrame"
  ],
  "frameworks": [
    "browser-native"
  ],
  "dependencies": [],
  "complexity": "medium",
  "performance_cost": "medium",
  "accessibility_risk": "medium",
  "mobile_suitability": "conditional",
  "reduced_motion_fallback": "Pin all layers to the same scroll position; render a flat, static composition with no depth offset.",
  "enterprise_suitability": "discouraged",
  "marketing_suitability": "recommended",
  "provenance": "original",
  "testing": [],
  "tags": [
    "scroll",
    "depth",
    "ambient"
  ]
}
